qid,espncricinfo_id,name,island,league,justification,source_url
Q12895415,,Pierre Garçon,HT,NFL,Born in New York to Haitian parents; identifies as Haitian-American,https://en.wikipedia.org/wiki/Pierre_Garçon
Q738690,,Roy Hibbert,JM,NBA,Father is Jamaican,https://en.wikipedia.org/wiki/Roy_Hibbert
Q1267622,,Patrick Ewing Jr.,JM,NBA,"Father Patrick Ewing was born in Kingston, Jamaica",https://en.wikipedia.org/wiki/Patrick_Ewing_Jr.
Q3079152,,Manny Machado,DO,MLB,Born in Miami to Dominican parents,https://en.wikipedia.org/wiki/Manny_Machado
Q3105192,,Giancarlo Stanton,PR,MLB,Of Puerto Rican descent through his father's family,https://en.wikipedia.org/wiki/Giancarlo_Stanton
